{
  "kind": "verdict",
  "lens": "verification-gap",
  "subject": "P-7F3K9Q.T2",
  "brief_hash": "BR-8a0c2e4f6b79",
  "commit": "3f1c2e9bbe37e64d9b279c5e82fb04be3f2be493",
  "diff_digest": "ce9b8ca9f55e304b83e4c9dd94c7a1204ee3605b74ba38396d5cd531621487f6",
  "contract_hash": "e90e8774ddb2fd72a1ba81b6149dd88cf5a721460a1ab3b0afd09be0cde09bea",
  "spec_verdict": "meets",
  "readings": [],
  "findings": [],
  "declined": [],
  "recommendation": "approve",
  "summary": "The builder added no tests. The frozen rows R-notes-4QX7B#S1 and #S2 pass at the round commit and failed at its base, so the evidence proves ACC-01 and ACC-02 without relying on builder-written tests."
}
